{
  "envelope_id": "env_12",
  "task_id": "t_12",
  "version": 2,
  "spend_cap": { "currency": "INR", "amount": 0 },
  "sub_caps": {},
  "contactable_parties": [{ "party": "party_max-healthcare", "scope": "task" }],
  "committable_acts": [{ "act": "schedule", "scope": "task" }, { "act": "cancel", "scope": "task" }],
  "delegated_identity_acts": [{ "act": "attest-fact", "scope": "task" }],
  "validity": { "from": "2026-09-02T14:35:00+05:30", "to": "2026-09-09T14:35:00+05:30" },
  "authorised_by": { "device": "dev_12a", "at": "2026-09-02T14:35:12+05:30" },
  "edits": [{ "version": 2, "change": "narrowed at authorisation: removed party 'the referring clinic'", "at": "2026-09-02T14:35:12+05:30", "kind": "authorisation", "scope": "task" }]
}
